{
  "deployment_id": "deploy-20260909-001",
  "image_digest": "sha256:2c26b46b68ffc68ff99b453c1d30413413422d706483bfa0f98a5e886266e7ae",
  "app_commit": "8ce06c1",
  "data_release_id": "tft-s18-18.1-cn-2026-09-09T09:00:00Z-22d22239",
  "prompt_version": "1.3.0",
  "policy_version": "1.0.0",
  "model_config_version": "1.1.0",
  "created_at": "2026-09-09T10:00:00Z"
}
